{
  "apiVersion": {
    "major": 2,
    "minor": 4
  },
  "operation": "search",
  "observedAt": "2026-09-25T00:00:00Z",
  "root": "/synthetic/kit",
  "diagnostics": [],
  "status": "ok",
  "data": {
    "query": "Demo",
    "items": [
      {
        "slug": "demo",
        "title": "Demo",
        "status": "active",
        "lastUpdated": "2026-10-19T06:47:48.446980+00:00",
        "path": "change.md",
        "line": 1,
        "heading": null,
        "snippet": "# Demo 变更说明"
      },
      {
        "slug": "demo",
        "title": "Demo",
        "status": "active",
        "lastUpdated": "2026-10-19T06:47:48.446980+00:00",
        "path": "README.md",
        "line": 1,
        "heading": null,
        "snippet": "# Demo"
      }
    ],
    "counts": {
      "total": 2
    },
    "collectionRevision": "sha256:5315cf708b87c246be05c2f2e0279dbf2ab4234672b3005e024b4f24f1575e13",
    "page": {
      "offset": 0,
      "limit": 20,
      "total": 2,
      "hasMore": false
    }
  },
  "responseRevision": "sha256:95a3777cd509d01b77e58df3755c8b45a3425bd311975fa404f03677e83983b6"
}
