{
  "apiVersion": {
    "major": 2,
    "minor": 4
  },
  "operation": "verification",
  "observedAt": "2026-09-25T00:00:00Z",
  "root": "/synthetic/kit",
  "diagnostics": [],
  "status": "ok",
  "data": {
    "recordedResult": "passed",
    "evidenceId": "sha256:2b627bc3096fdd22ad31016c4bbfe9ba00dd429b394269214093f786d6af6601",
    "applicability": "not_checked",
    "verificationScope": "",
    "pendingExternalChecks": [],
    "repositoryStates": [],
    "slug": "demo",
    "stateRevision": "sha256:7fc00e7cdb37e2f6d1c9aa168cff89cd9446733d13ae7c3c817fc78e9d313645",
    "record": {
      "basisRevision": "sha256:384171221a9d53c162445a9f4d8b15708ac8989e295cd971cc7bd6d010b1697e",
      "checks": [
        {
          "command": "fixture-check",
          "executed": 1,
          "exitStatus": 0,
          "result": "passed",
          "skipped": 0,
          "target": "behavior",
          "type": "测试",
          "workingDirectory": "kit"
        }
      ],
      "codeState": {
        "kit": "sha256:d9714589e36745089e8738cd7fdb437e8257799f27905fefdbf457ff0371c6c9"
      },
      "itemSlug": "demo",
      "iteration": "i01",
      "receipt": "sha256:f08f50b75f41ddc0a0a07a9a7135a28d7ffb70d79cb2b07a5059ffd226663599",
      "recordedAt": "2026-09-25T10:00:00+08:00",
      "result": "passed",
      "reviewResult": "passed",
      "schemaVersion": 1,
      "scope": "item",
      "taskId": null,
      "id": "sha256:2b627bc3096fdd22ad31016c4bbfe9ba00dd429b394269214093f786d6af6601"
    },
    "tasks": [
      {
        "id": "T01",
        "status": "completed",
        "evidenceId": "sha256:9b5463f474356ec6157b57562ba114c592f4c89c92c8422d9390f29524533ee7"
      }
    ],
    "progression": {
      "currentStage": "item.complete",
      "executionDecision": "RUN",
      "blockers": [],
      "readyTasks": [],
      "nextActions": [
        {
          "stage": "item.complete",
          "runbook": ".agents/skills/workspace-verify/SKILL.md"
        }
      ],
      "canComplete": false
    }
  },
  "responseRevision": "sha256:0124c39cd6eb68cde02c043e85bdb16a6261fbdddc68ff215c4d1ac054ff0edc"
}
