{
  "apiVersion": {
    "major": 2,
    "minor": 4
  },
  "operation": "runs",
  "observedAt": "2026-09-25T00:00:00Z",
  "root": "/synthetic/kit",
  "diagnostics": [],
  "status": "ok",
  "data": {
    "items": [],
    "counts": {
      "total": 0
    },
    "collectionRevision": "sha256:4f53cda18c2baa0c0354bb5f9a3ecbe5ed12ab4d8e11ba873c2f11161202b945",
    "page": {
      "offset": 0,
      "limit": 20,
      "total": 0,
      "hasMore": false
    }
  },
  "responseRevision": "sha256:c621f708571ca067cdbce61bf8c6e713f659a8aba5db8dbe89c6e742882a06a5"
}
