{
  "apiVersion": {
    "major": 2,
    "minor": 4
  },
  "operation": "projection",
  "observedAt": "2026-09-25T00:00:00Z",
  "root": "/synthetic/kit",
  "diagnostics": [],
  "status": "ok",
  "data": {
    "view": "summary",
    "slug": "demo",
    "stateRevision": "sha256:7fc00e7cdb37e2f6d1c9aa168cff89cd9446733d13ae7c3c817fc78e9d313645",
    "summary": {
      "slug": "demo",
      "title": "Demo",
      "description": "",
      "path": "docs/development/items/demo",
      "status": "active",
      "riskTier": "normal",
      "activity": "develop",
      "iteration": "i01",
      "stateRevision": "sha256:7fc00e7cdb37e2f6d1c9aa168cff89cd9446733d13ae7c3c817fc78e9d313645",
      "updatedAt": "2026-10-19T06:47:48.446980+00:00",
      "repositoryBindings": [
        {
          "baseBranch": "main",
          "repository": "kit",
          "workBranch": "main"
        }
      ],
      "progress": {
        "completed": 1,
        "total": 1,
        "plannedTotal": 1,
        "pendingApproval": 0,
        "changedApproval": 0,
        "execution": {
          "unknown": 0,
          "not-started": 0,
          "in-progress": 0,
          "implemented": 1
        },
        "verification": {
          "unverified": 0,
          "passed": 1,
          "failed": 0,
          "needs-revalidation": 0
        }
      },
      "reviews": {
        "change": "approved",
        "plan": "approved"
      },
      "verification": {
        "recordedResult": "passed",
        "evidenceId": "sha256:2b627bc3096fdd22ad31016c4bbfe9ba00dd429b394269214093f786d6af6601",
        "applicability": "not_checked",
        "verificationScope": "",
        "pendingExternalChecks": [],
        "repositoryStates": []
      },
      "documents": [
        {
          "role": "change",
          "path": "change.md",
          "documentRevision": "sha256:e7433783eb6f0cb4520ae24ae5338145d95bcc561be2e4e393e3cf0d7a11d36f",
          "bytes": 440,
          "lineCount": 17
        },
        {
          "role": "plan",
          "path": "plan.md",
          "documentRevision": "sha256:d7b578cd1186d62582211867115fc1700df6fa52105e8fdf13322ed4353e4130",
          "bytes": 191,
          "lineCount": 18
        },
        {
          "role": "readme",
          "path": "README.md",
          "documentRevision": "sha256:e90161b2cfab28777ecc6f212698e82048ecfbe881718bc9e694d84a3ae4edc6",
          "bytes": 780,
          "lineCount": 37
        }
      ],
      "artifactSummary": {
        "total": 1,
        "readable": 1,
        "unreadable": 0,
        "collectionRevision": "sha256:e6df3db950df080e3a7f293b5f2c9a9dd957f8461f959e48f8da43fc53227bfa"
      },
      "delivery": {},
      "executionBlockers": [],
      "cancellation": null,
      "currentStage": "item.complete",
      "executionDecision": "RUN",
      "blockers": [],
      "readyTasks": [],
      "nextActions": [
        {
          "stage": "item.complete",
          "runbook": ".agents/skills/workspace-verify/SKILL.md"
        }
      ],
      "canComplete": false,
      "completionAction": {
        "available": true,
        "reason": null
      }
    },
    "progression": {
      "currentStage": "item.complete",
      "executionDecision": "RUN",
      "blockers": [],
      "readyTasks": [],
      "nextActions": [
        {
          "stage": "item.complete",
          "runbook": ".agents/skills/workspace-verify/SKILL.md"
        }
      ],
      "canComplete": false
    },
    "documents": [
      {
        "role": "change",
        "path": "change.md",
        "documentRevision": "sha256:e7433783eb6f0cb4520ae24ae5338145d95bcc561be2e4e393e3cf0d7a11d36f",
        "bytes": 440,
        "lineCount": 17
      },
      {
        "role": "plan",
        "path": "plan.md",
        "documentRevision": "sha256:d7b578cd1186d62582211867115fc1700df6fa52105e8fdf13322ed4353e4130",
        "bytes": 191,
        "lineCount": 18
      },
      {
        "role": "readme",
        "path": "README.md",
        "documentRevision": "sha256:e90161b2cfab28777ecc6f212698e82048ecfbe881718bc9e694d84a3ae4edc6",
        "bytes": 780,
        "lineCount": 37
      }
    ]
  },
  "responseRevision": "sha256:3247b6c2b7a15d8df92cbeca610c616f93ebe6f5c46b7b9c17260ea37fb070d2"
}
