{
  "apiVersion": {
    "major": 2,
    "minor": 4
  },
  "operation": "projection",
  "observedAt": "2026-09-25T00:00:00Z",
  "root": "/synthetic/kit",
  "diagnostics": [],
  "status": "ok",
  "data": {
    "view": "change",
    "slug": "demo",
    "stateRevision": "sha256:7fc00e7cdb37e2f6d1c9aa168cff89cd9446733d13ae7c3c817fc78e9d313645",
    "repositories": [
      {
        "baseBranch": "main",
        "repository": "kit",
        "workBranch": "main",
        "absolutePath": "/synthetic/kit"
      }
    ],
    "comparison": {
      "kind": "merge-base",
      "source": "item-bindings"
    }
  },
  "responseRevision": "sha256:4c53c3854e3467c5c93604cc1634250ea7ac2178cf8955b79ca0eaa0a844b3d3"
}
