{
  "apiVersion": {
    "major": 2,
    "minor": 4
  },
  "operation": "document",
  "observedAt": "2026-09-25T00:00:00Z",
  "root": "/synthetic/kit",
  "diagnostics": [],
  "status": "ok",
  "data": {
    "slug": "demo",
    "path": "change.md",
    "documentRevision": "sha256:e7433783eb6f0cb4520ae24ae5338145d95bcc561be2e4e393e3cf0d7a11d36f",
    "content": "# Demo 变更说明\n\n## 目标与范围\n\n\n\n## 已知事实与关键假设\n\n仅保留会影响本次结果的事实、未知项与来源。\n\n## 验收与检查\n\n说明角色、条件、触发、可观察结果和必要反例；选择能证明该要求的检查入口。\n\n## 方案与工作项\n\n按实际工作列出动作，不维护完成复选框。普通需求默认一次整体验证，有真实依赖或接力需要才增加 plan.md。\n",
    "bytes": 440,
    "lineCount": 17,
    "mediaType": "text/markdown"
  },
  "responseRevision": "sha256:42ed126a36b1ff5840cd8d584a6c27fa0fe13a41b950a1c2bd038427fa84ca5d"
}
