{
  "apiVersion": {
    "major": 2,
    "minor": 4
  },
  "operation": "workspace",
  "observedAt": "2026-09-25T00:00:00Z",
  "root": "/synthetic/kit",
  "diagnostics": [],
  "status": "ok",
  "data": {
    "mode": "maintenance",
    "identity": {
      "name": "kit"
    },
    "repositories": [
      {
        "id": "kit",
        "role": "kit",
        "absolutePath": "/synthetic/kit",
        "aliases": [],
        "category": "kit",
        "description": "工作流 Kit",
        "availability": "present",
        "effectiveBranchPolicy": null
      }
    ],
    "localContext": {},
    "configuration": {},
    "protocol": {
      "apiVersion": {
        "major": 2,
        "minor": 4
      },
      "operations": [
        "workspace",
        "items",
        "projection",
        "document",
        "artifacts",
        "verification",
        "evidence",
        "handoff",
        "search",
        "workflow",
        "runs",
        "run"
      ],
      "kitVersion": "2.0.0"
    }
  },
  "responseRevision": "sha256:8b3add737992229909452121620034907477580926319b648baf9779aa40e10d"
}
