{
  "apiVersion": {
    "major": 2,
    "minor": 4
  },
  "operation": "projection",
  "observedAt": "2026-09-25T00:00:00Z",
  "root": "/synthetic/kit",
  "diagnostics": [],
  "status": "ok",
  "data": {
    "view": "flow",
    "slug": "demo",
    "stateRevision": "sha256:7fc00e7cdb37e2f6d1c9aa168cff89cd9446733d13ae7c3c817fc78e9d313645",
    "status": "active",
    "delivery": {
      "repositories": {},
      "externalChecks": []
    },
    "verification": {
      "recordedResult": "passed",
      "evidenceId": "sha256:2b627bc3096fdd22ad31016c4bbfe9ba00dd429b394269214093f786d6af6601",
      "applicability": "not_checked",
      "verificationScope": "",
      "pendingExternalChecks": [],
      "repositoryStates": []
    },
    "workflow": {
      "enabled": false,
      "configState": "disabled",
      "extensions": []
    },
    "executionBlockers": [],
    "cancellation": null
  },
  "responseRevision": "sha256:ce6dd29a6108b6bd1a18565deec2671689326415f771a9afad628b1b73dc5105"
}
