{
  "apiVersion": {
    "major": 2,
    "minor": 4
  },
  "operation": "artifacts",
  "observedAt": "2026-09-25T00:00:00Z",
  "root": "/synthetic/kit",
  "diagnostics": [],
  "status": "ok",
  "data": {
    "slug": "demo",
    "items": [
      {
        "role": "artifacts",
        "path": "artifacts/report.json",
        "bytes": 18,
        "readable": true,
        "documentRevision": null
      }
    ],
    "counts": {
      "total": 1
    },
    "collectionRevision": "sha256:e6df3db950df080e3a7f293b5f2c9a9dd957f8461f959e48f8da43fc53227bfa",
    "page": {
      "offset": 0,
      "limit": 50,
      "total": 1,
      "hasMore": false
    }
  },
  "responseRevision": "sha256:2975fe01490c4753570cc7590523d3cb945580c86dbe15fc4f37f346dbdaf5f2"
}
