{
  "apiVersion": {
    "major": 2,
    "minor": 4
  },
  "operation": "items",
  "observedAt": "2026-09-25T00:00:00Z",
  "root": "/synthetic/kit",
  "diagnostics": [],
  "status": "ok",
  "data": {
    "items": [
      {
        "slug": "demo",
        "title": "Demo",
        "status": "active",
        "iteration": "i01",
        "riskTier": "normal",
        "activity": "develop",
        "path": "docs/development/items/demo",
        "stateRevision": "sha256:7fc00e7cdb37e2f6d1c9aa168cff89cd9446733d13ae7c3c817fc78e9d313645",
        "updatedAt": "2026-10-19T06:47:48.446980+00:00",
        "repositoryBindings": [
          {
            "baseBranch": "main",
            "repository": "kit",
            "workBranch": "main"
          }
        ],
        "progress": {
          "completed": 1,
          "total": 1,
          "basis": "recorded"
        },
        "cancellation": null,
        "openBlockerCount": 0,
        "verification": {
          "evidenceId": "sha256:2b627bc3096fdd22ad31016c4bbfe9ba00dd429b394269214093f786d6af6601",
          "recordedResult": "passed",
          "applicability": "not_checked"
        }
      }
    ],
    "counts": {
      "total": 1
    },
    "collectionRevision": "sha256:4e3933e0c1c105b34c05b3049b3ef0d77c410143d8e00b87b103655dbd0f981d",
    "page": {
      "offset": 0,
      "limit": 20,
      "total": 1,
      "hasMore": false
    }
  },
  "responseRevision": "sha256:f51a814165a37eecd41e878df3441b7b32500e8bd28f8f8ae96b8c93bd0d1744"
}
